"bottle made of 2 1⁄2"" heavy wall pyrex that contains silica gel, calcium sulfate, and activated charcoal (not","bottle made of 2 1⁄2"" heavy wall pyrex that contains silica gel, calcium sulfate, and activated charcoal (not","bottle made of 2 1⁄2"" heavy wall pyrex that contains silica gel, calcium sulfate, and activated charcoal (not","bottle made of 2 1⁄2"" heavy wall pyrex that contains silica gel, calcium sulfate, and activated charcoal (not","bottle made of 2 1⁄2"" heavy wall pyrex that contains silica gel, calcium sulfate, and activated charcoal (not","bottle made of 2 1⁄2"" heavy wall pyrex that contains silica gel, calcium sulfate, and activated charcoal (not","bottle made of 2 1⁄2"" heavy wall pyrex that contains silica gel, calcium sulfate, and activated charcoal (not","bottle made of 2 1⁄2"" heavy wall pyrex that contains silica gel, calcium sulfate, and activated charcoal (not","bottle made of 2 1⁄2"" heavy wall pyrex that contains silica gel, calcium sulfate, and activated charcoal (not","bottle made of 2 1⁄2"" heavy wall pyrex that contains silica gel, calcium sulfate, and activated charcoal (not","bottle made of 2 1⁄2"" heavy wall pyrex that contains silica gel, calcium sulfate, and activated charcoal (not","bottle made of 2 1⁄2"" heavy wall pyrex that contains silica gel, calcium sulfate, and activated charcoal (not","bottle made of 2 1⁄2"" heavy wall pyrex that contains silica gel, calcium sulfate, and activated charcoal (not"
available with assembly).,available with assembly).,The tubing that connects the dryer/cleaner bottle to the drying manifold should be,The tubing that connects the dryer/cleaner bottle to the drying manifold should be,The tubing that connects the dryer/cleaner bottle to the drying manifold should be,The tubing that connects the dryer/cleaner bottle to the drying manifold should be,The tubing that connects the dryer/cleaner bottle to the drying manifold should be,The tubing that connects the dryer/cleaner bottle to the drying manifold should be,The tubing that connects the dryer/cleaner bottle to the drying manifold should be,The tubing that connects the dryer/cleaner bottle to the drying manifold should be,The tubing that connects the dryer/cleaner bottle to the drying manifold should be,The tubing that connects the dryer/cleaner bottle to the drying manifold should be,The tubing that connects the dryer/cleaner bottle to the drying manifold should be
secured at each cap with either Teflon® washers or Teflon® washers coupled with Teflon® hose barbs.,secured at each cap with either Teflon® washers or Teflon® washers coupled with Teflon® hose barbs.,secured at each cap with either Teflon® washers or Teflon® washers coupled with Teflon® hose barbs.,secured at each cap with either Teflon® washers or Teflon® washers coupled with Teflon® hose barbs.,secured at each cap with either Teflon® washers or Teflon® washers coupled with Teflon® hose barbs.,secured at each cap with either Teflon® washers or Teflon® washers coupled with Teflon® hose barbs.,secured at each cap with either Teflon® washers or Teflon® washers coupled with Teflon® hose barbs.,secured at each cap with either Teflon® washers or Teflon® washers coupled with Teflon® hose barbs.,secured at each cap with either Teflon® washers or Teflon® washers coupled with Teflon® hose barbs.,secured at each cap with either Teflon® washers or Teflon® washers coupled with Teflon® hose barbs.,secured at each cap with either Teflon® washers or Teflon® washers coupled with Teflon® hose barbs.,secured at each cap with either Teflon® washers or Teflon® washers coupled with Teflon® hose barbs.,
A mixture of activated carbon/drying agent/sodium carbonate flux (~50 g) is contained in the,A mixture of activated carbon/drying agent/sodium carbonate flux (~50 g) is contained in the,A mixture of activated carbon/drying agent/sodium carbonate flux (~50 g) is contained in the,A mixture of activated carbon/drying agent/sodium carbonate flux (~50 g) is contained in the,A mixture of activated carbon/drying agent/sodium carbonate flux (~50 g) is contained in the,A mixture of activated carbon/drying agent/sodium carbonate flux (~50 g) is contained in the,A mixture of activated carbon/drying agent/sodium carbonate flux (~50 g) is contained in the,A mixture of activated carbon/drying agent/sodium carbonate flux (~50 g) is contained in the,A mixture of activated carbon/drying agent/sodium carbonate flux (~50 g) is contained in the,A mixture of activated carbon/drying agent/sodium carbonate flux (~50 g) is contained in the,A mixture of activated carbon/drying agent/sodium carbonate flux (~50 g) is contained in the,A mixture of activated carbon/drying agent/sodium carbonate flux (~50 g) is contained in the,A mixture of activated carbon/drying agent/sodium carbonate flux (~50 g) is contained in the
dryer/cleaner bottle to scrub contaminants from the supply air source.,dryer/cleaner bottle to scrub contaminants from the supply air source.,dryer/cleaner bottle to scrub contaminants from the supply air source.,dryer/cleaner bottle to scrub contaminants from the supply air source.,dryer/cleaner bottle to scrub contaminants from the supply air source.,dryer/cleaner bottle to scrub contaminants from the supply air source.,dryer/cleaner bottle to scrub contaminants from the supply air source.,dryer/cleaner bottle to scrub contaminants from the supply air source.,,,,,
7.1.9,Vacuum Tubing.,"Low density polyethylene tubing, 3/8"" diameter for distances of less than 50 ft.,","Low density polyethylene tubing, 3/8"" diameter for distances of less than 50 ft.,","Low density polyethylene tubing, 3/8"" diameter for distances of less than 50 ft.,","Low density polyethylene tubing, 3/8"" diameter for distances of less than 50 ft.,","Low density polyethylene tubing, 3/8"" diameter for distances of less than 50 ft.,","Low density polyethylene tubing, 3/8"" diameter for distances of less than 50 ft.,","Low density polyethylene tubing, 3/8"" diameter for distances of less than 50 ft.,","Low density polyethylene tubing, 3/8"" diameter for distances of less than 50 ft.,","Low density polyethylene tubing, 3/8"" diameter for distances of less than 50 ft.,","Low density polyethylene tubing, 3/8"" diameter for distances of less than 50 ft.,","Low density polyethylene tubing, 3/8"" diameter for distances of less than 50 ft.,"
"1⁄2"" diameter for distances greater than 50 ft.","1⁄2"" diameter for distances greater than 50 ft.","1⁄2"" diameter for distances greater than 50 ft.","1⁄2"" diameter for distances greater than 50 ft.","Since this tubing is used downstream from the sampler, similar","Since this tubing is used downstream from the sampler, similar","Since this tubing is used downstream from the sampler, similar","Since this tubing is used downstream from the sampler, similar","Since this tubing is used downstream from the sampler, similar","Since this tubing is used downstream from the sampler, similar","Since this tubing is used downstream from the sampler, similar","Since this tubing is used downstream from the sampler, similar","Since this tubing is used downstream from the sampler, similar"
sized tubing or pipe of any material may be substituted.,sized tubing or pipe of any material may be substituted.,sized tubing or pipe of any material may be substituted.,sized tubing or pipe of any material may be substituted.,sized tubing or pipe of any material may be substituted.,sized tubing or pipe of any material may be substituted.,The tubing must have sufficient strength to avoid,The tubing must have sufficient strength to avoid,The tubing must have sufficient strength to avoid,The tubing must have sufficient strength to avoid,The tubing must have sufficient strength to avoid,The tubing must have sufficient strength to avoid,The tubing must have sufficient strength to avoid
"collapsing under vacuum [Fisher-Scientific, 711 Forbes Ave., Pittsburgh, PA 15219, (412-787-6322)].","collapsing under vacuum [Fisher-Scientific, 711 Forbes Ave., Pittsburgh, PA 15219, (412-787-6322)].","collapsing under vacuum [Fisher-Scientific, 711 Forbes Ave., Pittsburgh, PA 15219, (412-787-6322)].","collapsing under vacuum [Fisher-Scientific, 711 Forbes Ave., Pittsburgh, PA 15219, (412-787-6322)].","collapsing under vacuum [Fisher-Scientific, 711 Forbes Ave., Pittsburgh, PA 15219, (412-787-6322)].","collapsing under vacuum [Fisher-Scientific, 711 Forbes Ave., Pittsburgh, PA 15219, (412-787-6322)].","collapsing under vacuum [Fisher-Scientific, 711 Forbes Ave., Pittsburgh, PA 15219, (412-787-6322)].","collapsing under vacuum [Fisher-Scientific, 711 Forbes Ave., Pittsburgh, PA 15219, (412-787-6322)].","collapsing under vacuum [Fisher-Scientific, 711 Forbes Ave., Pittsburgh, PA 15219, (412-787-6322)].","collapsing under vacuum [Fisher-Scientific, 711 Forbes Ave., Pittsburgh, PA 15219, (412-787-6322)].","collapsing under vacuum [Fisher-Scientific, 711 Forbes Ave., Pittsburgh, PA 15219, (412-787-6322)].",,
7.1.10,Tube Fitting.,"Compression fittings (Swagelok®, Gyrolok® or equivalent) to connect vacuum","Compression fittings (Swagelok®, Gyrolok® or equivalent) to connect vacuum","Compression fittings (Swagelok®, Gyrolok® or equivalent) to connect vacuum","Compression fittings (Swagelok®, Gyrolok® or equivalent) to connect vacuum","Compression fittings (Swagelok®, Gyrolok® or equivalent) to connect vacuum","Compression fittings (Swagelok®, Gyrolok® or equivalent) to connect vacuum","Compression fittings (Swagelok®, Gyrolok® or equivalent) to connect vacuum","Compression fittings (Swagelok®, Gyrolok® or equivalent) to connect vacuum","Compression fittings (Swagelok®, Gyrolok® or equivalent) to connect vacuum","Compression fittings (Swagelok®, Gyrolok® or equivalent) to connect vacuum","Compression fittings (Swagelok®, Gyrolok® or equivalent) to connect vacuum"
tubing (above) to an NPT female connector or filter holder and connect vacuum tubing to fitting on differential,tubing (above) to an NPT female connector or filter holder and connect vacuum tubing to fitting on differential,tubing (above) to an NPT female connector or filter holder and connect vacuum tubing to fitting on differential,tubing (above) to an NPT female connector or filter holder and connect vacuum tubing to fitting on differential,tubing (above) to an NPT female connector or filter holder and connect vacuum tubing to fitting on differential,tubing (above) to an NPT female connector or filter holder and connect vacuum tubing to fitting on differential,tubing (above) to an NPT female connector or filter holder and connect vacuum tubing to fitting on differential,tubing (above) to an NPT female connector or filter holder and connect vacuum tubing to fitting on differential,tubing (above) to an NPT female connector or filter holder and connect vacuum tubing to fitting on differential,tubing (above) to an NPT female connector or filter holder and connect vacuum tubing to fitting on differential,tubing (above) to an NPT female connector or filter holder and connect vacuum tubing to fitting on differential,tubing (above) to an NPT female connector or filter holder and connect vacuum tubing to fitting on differential,tubing (above) to an NPT female connector or filter holder and connect vacuum tubing to fitting on differential
flow controller.,The fittings may be constructed of any material since they are downstream of the sampler,The fittings may be constructed of any material since they are downstream of the sampler,The fittings may be constructed of any material since they are downstream of the sampler,The fittings may be constructed of any material since they are downstream of the sampler,The fittings may be constructed of any material since they are downstream of the sampler,The fittings may be constructed of any material since they are downstream of the sampler,The fittings may be constructed of any material since they are downstream of the sampler,The fittings may be constructed of any material since they are downstream of the sampler,The fittings may be constructed of any material since they are downstream of the sampler,The fittings may be constructed of any material since they are downstream of the sampler,The fittings may be constructed of any material since they are downstream of the sampler,The fittings may be constructed of any material since they are downstream of the sampler
"[Fisher-Scientific, 711 Forbes Ave., Pittsburgh, PA 15219, (412-787-6322)].","[Fisher-Scientific, 711 Forbes Ave., Pittsburgh, PA 15219, (412-787-6322)].","[Fisher-Scientific, 711 Forbes Ave., Pittsburgh, PA 15219, (412-787-6322)].","[Fisher-Scientific, 711 Forbes Ave., Pittsburgh, PA 15219, (412-787-6322)].","[Fisher-Scientific, 711 Forbes Ave., Pittsburgh, PA 15219, (412-787-6322)].","[Fisher-Scientific, 711 Forbes Ave., Pittsburgh, PA 15219, (412-787-6322)].","[Fisher-Scientific, 711 Forbes Ave., Pittsburgh, PA 15219, (412-787-6322)].","[Fisher-Scientific, 711 Forbes Ave., Pittsburgh, PA 15219, (412-787-6322)].","[Fisher-Scientific, 711 Forbes Ave., Pittsburgh, PA 15219, (412-787-6322)].",,,,
7.1.11,Annular Denuder System Sampling Case (see Figure 10).,Annular Denuder System Sampling Case (see Figure 10).,Annular Denuder System Sampling Case (see Figure 10).,Annular Denuder System Sampling Case (see Figure 10).,Annular Denuder System Sampling Case (see Figure 10).,Annular Denuder System Sampling Case (see Figure 10).,Annular Denuder System Sampling Case (see Figure 10).,"Made of a ""high-impact"" plastic and","Made of a ""high-impact"" plastic and","Made of a ""high-impact"" plastic and","Made of a ""high-impact"" plastic and","Made of a ""high-impact"" plastic and"
insulated with polyurethane.,insulated with polyurethane.,"It is 4 ft long by 6"" wide and 6"" deep.","It is 4 ft long by 6"" wide and 6"" deep.","It is 4 ft long by 6"" wide and 6"" deep.","It is 4 ft long by 6"" wide and 6"" deep.","It is 4 ft long by 6"" wide and 6"" deep.","Two heater units, a fan blower, and an air","Two heater units, a fan blower, and an air","Two heater units, a fan blower, and an air","Two heater units, a fan blower, and an air","Two heater units, a fan blower, and an air","Two heater units, a fan blower, and an air"
outlet are located in the lid of the housing.,outlet are located in the lid of the housing.,outlet are located in the lid of the housing.,outlet are located in the lid of the housing.,"Also, located on the lid are the automatic and manual control","Also, located on the lid are the automatic and manual control","Also, located on the lid are the automatic and manual control","Also, located on the lid are the automatic and manual control","Also, located on the lid are the automatic and manual control","Also, located on the lid are the automatic and manual control","Also, located on the lid are the automatic and manual control","Also, located on the lid are the automatic and manual control","Also, located on the lid are the automatic and manual control"
switches and a 12-V power supply outlet for the heater and fan.,switches and a 12-V power supply outlet for the heater and fan.,switches and a 12-V power supply outlet for the heater and fan.,switches and a 12-V power supply outlet for the heater and fan.,switches and a 12-V power supply outlet for the heater and fan.,switches and a 12-V power supply outlet for the heater and fan.,switches and a 12-V power supply outlet for the heater and fan.,The bottom of the box houses the ADS.,The bottom of the box houses the ADS.,The bottom of the box houses the ADS.,The bottom of the box houses the ADS.,The,The
"elutriator end of the ADS protrudes through one end of the box, while the denuders are supported in the box","elutriator end of the ADS protrudes through one end of the box, while the denuders are supported in the box","elutriator end of the ADS protrudes through one end of the box, while the denuders are supported in the box","elutriator end of the ADS protrudes through one end of the box, while the denuders are supported in the box","elutriator end of the ADS protrudes through one end of the box, while the denuders are supported in the box","elutriator end of the ADS protrudes through one end of the box, while the denuders are supported in the box","elutriator end of the ADS protrudes through one end of the box, while the denuders are supported in the box","elutriator end of the ADS protrudes through one end of the box, while the denuders are supported in the box","elutriator end of the ADS protrudes through one end of the box, while the denuders are supported in the box","elutriator end of the ADS protrudes through one end of the box, while the denuders are supported in the box","elutriator end of the ADS protrudes through one end of the box, while the denuders are supported in the box","elutriator end of the ADS protrudes through one end of the box, while the denuders are supported in the box","elutriator end of the ADS protrudes through one end of the box, while the denuders are supported in the box"
by chrome plated spring clips.,by chrome plated spring clips.,"If the Teflon®-coated aluminum cyclone is used to remove coarse particles, it","If the Teflon®-coated aluminum cyclone is used to remove coarse particles, it","If the Teflon®-coated aluminum cyclone is used to remove coarse particles, it","If the Teflon®-coated aluminum cyclone is used to remove coarse particles, it","If the Teflon®-coated aluminum cyclone is used to remove coarse particles, it","If the Teflon®-coated aluminum cyclone is used to remove coarse particles, it","If the Teflon®-coated aluminum cyclone is used to remove coarse particles, it","If the Teflon®-coated aluminum cyclone is used to remove coarse particles, it","If the Teflon®-coated aluminum cyclone is used to remove coarse particles, it","If the Teflon®-coated aluminum cyclone is used to remove coarse particles, it","If the Teflon®-coated aluminum cyclone is used to remove coarse particles, it"
"is also housed in the heated sampling box, with the elutriator end protruding through the sampling box.","is also housed in the heated sampling box, with the elutriator end protruding through the sampling box.","is also housed in the heated sampling box, with the elutriator end protruding through the sampling box.","is also housed in the heated sampling box, with the elutriator end protruding through the sampling box.","is also housed in the heated sampling box, with the elutriator end protruding through the sampling box.","is also housed in the heated sampling box, with the elutriator end protruding through the sampling box.","is also housed in the heated sampling box, with the elutriator end protruding through the sampling box.","is also housed in the heated sampling box, with the elutriator end protruding through the sampling box.","is also housed in the heated sampling box, with the elutriator end protruding through the sampling box.","is also housed in the heated sampling box, with the elutriator end protruding through the sampling box.","is also housed in the heated sampling box, with the elutriator end protruding through the sampling box.","is also housed in the heated sampling box, with the elutriator end protruding through the sampling box.",A
"vacuum plug known as a ""quick-release"" coupler is linked to the filter pack of the ADS. This plug connects the","vacuum plug known as a ""quick-release"" coupler is linked to the filter pack of the ADS. This plug connects the","vacuum plug known as a ""quick-release"" coupler is linked to the filter pack of the ADS. This plug connects the","vacuum plug known as a ""quick-release"" coupler is linked to the filter pack of the ADS. This plug connects the","vacuum plug known as a ""quick-release"" coupler is linked to the filter pack of the ADS. This plug connects the","vacuum plug known as a ""quick-release"" coupler is linked to the filter pack of the ADS. This plug connects the","vacuum plug known as a ""quick-release"" coupler is linked to the filter pack of the ADS. This plug connects the","vacuum plug known as a ""quick-release"" coupler is linked to the filter pack of the ADS. This plug connects the","vacuum plug known as a ""quick-release"" coupler is linked to the filter pack of the ADS. This plug connects the","vacuum plug known as a ""quick-release"" coupler is linked to the filter pack of the ADS. This plug connects the","vacuum plug known as a ""quick-release"" coupler is linked to the filter pack of the ADS. This plug connects the","vacuum plug known as a ""quick-release"" coupler is linked to the filter pack of the ADS. This plug connects the","vacuum plug known as a ""quick-release"" coupler is linked to the filter pack of the ADS. This plug connects the"
"ADS to 1 1/4""","Teflon® rubber ""clad"" shrink tubing that exhausts the air stream to the ambient air.","Teflon® rubber ""clad"" shrink tubing that exhausts the air stream to the ambient air.","Teflon® rubber ""clad"" shrink tubing that exhausts the air stream to the ambient air.","Teflon® rubber ""clad"" shrink tubing that exhausts the air stream to the ambient air.","Teflon® rubber ""clad"" shrink tubing that exhausts the air stream to the ambient air.","Teflon® rubber ""clad"" shrink tubing that exhausts the air stream to the ambient air.","Teflon® rubber ""clad"" shrink tubing that exhausts the air stream to the ambient air.","Teflon® rubber ""clad"" shrink tubing that exhausts the air stream to the ambient air.","Teflon® rubber ""clad"" shrink tubing that exhausts the air stream to the ambient air.","Teflon® rubber ""clad"" shrink tubing that exhausts the air stream to the ambient air.",The box,The box
is sledge hammer proof.,is sledge hammer proof.,,,,,,,,,,,
Page 4.2-6,,Compendium of Methods for Inorganic Air Pollutants,Compendium of Methods for Inorganic Air Pollutants,Compendium of Methods for Inorganic Air Pollutants,Compendium of Methods for Inorganic Air Pollutants,Compendium of Methods for Inorganic Air Pollutants,Compendium of Methods for Inorganic Air Pollutants,Compendium of Methods for Inorganic Air Pollutants,,,June 1999,June 1999
