Name: “Table 1 of 1 on page 10 of 68”,Name: “Table 1 of 1 on page 10 of 68”,Name: “Table 1 of 1 on page 10 of 68”,Name: “Table 1 of 1 on page 10 of 68”,Name: “Table 1 of 1 on page 10 of 68”,Name: “Table 1 of 1 on page 10 of 68”,Name: “Table 1 of 1 on page 10 of 68”,Name: “Table 1 of 1 on page 10 of 68”,Name: “Table 1 of 1 on page 10 of 68”,Name: “Table 1 of 1 on page 10 of 68”,Name: “Table 1 of 1 on page 10 of 68”,Name: “Table 1 of 1 on page 10 of 68”,Name: “Table 1 of 1 on page 10 of 68”
Table: 10,Table: 10,Table: 10,Table: 10,Table: 10,Table: 10,Table: 10,Table: 10,Table: 10,Table: 10,Table: 10,Table: 10,Table: 10
,,,,,,,,,,,,
Method IO-4.2,,,,,,,,,,,Chapter IO-4,Chapter IO-4
Acidic/Basic Constituents,Acidic/Basic Constituents,,,,,,,,Atmospheric Acidic,Atmospheric Acidic,Atmospheric Acidic,Atmospheric Acidic
7.1.5,Caps for Annular Denuder (see Figure 2).,Caps for Annular Denuder (see Figure 2).,Caps for Annular Denuder (see Figure 2).,Caps for Annular Denuder (see Figure 2).,Caps for Annular Denuder (see Figure 2).,Caps are made of either polyethylene or thermoplastic,Caps are made of either polyethylene or thermoplastic,Caps are made of either polyethylene or thermoplastic,Caps are made of either polyethylene or thermoplastic,Caps are made of either polyethylene or thermoplastic,Caps are made of either polyethylene or thermoplastic,Caps are made of either polyethylene or thermoplastic
and are used in the coating and drying processes and for storage and shipment. The thermo-plastic caps include,and are used in the coating and drying processes and for storage and shipment. The thermo-plastic caps include,and are used in the coating and drying processes and for storage and shipment. The thermo-plastic caps include,and are used in the coating and drying processes and for storage and shipment. The thermo-plastic caps include,and are used in the coating and drying processes and for storage and shipment. The thermo-plastic caps include,and are used in the coating and drying processes and for storage and shipment. The thermo-plastic caps include,and are used in the coating and drying processes and for storage and shipment. The thermo-plastic caps include,and are used in the coating and drying processes and for storage and shipment. The thermo-plastic caps include,and are used in the coating and drying processes and for storage and shipment. The thermo-plastic caps include,and are used in the coating and drying processes and for storage and shipment. The thermo-plastic caps include,and are used in the coating and drying processes and for storage and shipment. The thermo-plastic caps include,and are used in the coating and drying processes and for storage and shipment. The thermo-plastic caps include,and are used in the coating and drying processes and for storage and shipment. The thermo-plastic caps include
a removable Teflon® seal plate when purchased.,a removable Teflon® seal plate when purchased.,a removable Teflon® seal plate when purchased.,a removable Teflon® seal plate when purchased.,a removable Teflon® seal plate when purchased.,Repeated reuse of these types of caps have caused some,Repeated reuse of these types of caps have caused some,Repeated reuse of these types of caps have caused some,Repeated reuse of these types of caps have caused some,Repeated reuse of these types of caps have caused some,Repeated reuse of these types of caps have caused some,Repeated reuse of these types of caps have caused some,Repeated reuse of these types of caps have caused some
"contamination due to improper cleaning of the cap and Teflon® seal plate (i.e., fluid tends to be trapped under","contamination due to improper cleaning of the cap and Teflon® seal plate (i.e., fluid tends to be trapped under","contamination due to improper cleaning of the cap and Teflon® seal plate (i.e., fluid tends to be trapped under","contamination due to improper cleaning of the cap and Teflon® seal plate (i.e., fluid tends to be trapped under","contamination due to improper cleaning of the cap and Teflon® seal plate (i.e., fluid tends to be trapped under","contamination due to improper cleaning of the cap and Teflon® seal plate (i.e., fluid tends to be trapped under","contamination due to improper cleaning of the cap and Teflon® seal plate (i.e., fluid tends to be trapped under","contamination due to improper cleaning of the cap and Teflon® seal plate (i.e., fluid tends to be trapped under","contamination due to improper cleaning of the cap and Teflon® seal plate (i.e., fluid tends to be trapped under","contamination due to improper cleaning of the cap and Teflon® seal plate (i.e., fluid tends to be trapped under","contamination due to improper cleaning of the cap and Teflon® seal plate (i.e., fluid tends to be trapped under","contamination due to improper cleaning of the cap and Teflon® seal plate (i.e., fluid tends to be trapped under","contamination due to improper cleaning of the cap and Teflon® seal plate (i.e., fluid tends to be trapped under"
the seal plate).,The polyethylene caps are not equipped with seal plates.,The polyethylene caps are not equipped with seal plates.,The polyethylene caps are not equipped with seal plates.,The polyethylene caps are not equipped with seal plates.,The polyethylene caps are not equipped with seal plates.,The polyethylene caps are not equipped with seal plates.,The polyethylene caps are not equipped with seal plates.,Polyethylene caps tend to dry faster,Polyethylene caps tend to dry faster,Polyethylene caps tend to dry faster,Polyethylene caps tend to dry faster,Polyethylene caps tend to dry faster
and seal better than the thermoplastic caps.,and seal better than the thermoplastic caps.,and seal better than the thermoplastic caps.,and seal better than the thermoplastic caps.,,,,,,,,,
7.1.6,Annular Denuder Couplers (see Figure 4).,Annular Denuder Couplers (see Figure 4).,Annular Denuder Couplers (see Figure 4).,Annular Denuder Couplers (see Figure 4).,Annular Denuder Couplers (see Figure 4).,The couplers should be made of thermoplastic and,The couplers should be made of thermoplastic and,The couplers should be made of thermoplastic and,The couplers should be made of thermoplastic and,The couplers should be made of thermoplastic and,The couplers should be made of thermoplastic and,The couplers should be made of thermoplastic and
"equipped with Teflon® ""O""-rings that sandwich a silicone rubber ring on three sides.","equipped with Teflon® ""O""-rings that sandwich a silicone rubber ring on three sides.","equipped with Teflon® ""O""-rings that sandwich a silicone rubber ring on three sides.","equipped with Teflon® ""O""-rings that sandwich a silicone rubber ring on three sides.","equipped with Teflon® ""O""-rings that sandwich a silicone rubber ring on three sides.","equipped with Teflon® ""O""-rings that sandwich a silicone rubber ring on three sides.","equipped with Teflon® ""O""-rings that sandwich a silicone rubber ring on three sides.","equipped with Teflon® ""O""-rings that sandwich a silicone rubber ring on three sides.","equipped with Teflon® ""O""-rings that sandwich a silicone rubber ring on three sides.",This design provides,This design provides,This design provides,This design provides
elasticity for better sealing under extremely cold temperature conditions in which Teflon® does not give.,elasticity for better sealing under extremely cold temperature conditions in which Teflon® does not give.,elasticity for better sealing under extremely cold temperature conditions in which Teflon® does not give.,elasticity for better sealing under extremely cold temperature conditions in which Teflon® does not give.,elasticity for better sealing under extremely cold temperature conditions in which Teflon® does not give.,elasticity for better sealing under extremely cold temperature conditions in which Teflon® does not give.,elasticity for better sealing under extremely cold temperature conditions in which Teflon® does not give.,elasticity for better sealing under extremely cold temperature conditions in which Teflon® does not give.,elasticity for better sealing under extremely cold temperature conditions in which Teflon® does not give.,elasticity for better sealing under extremely cold temperature conditions in which Teflon® does not give.,elasticity for better sealing under extremely cold temperature conditions in which Teflon® does not give.,Two,Two
types of couplers are available.,types of couplers are available.,"In the older version, the couplers have removable seal rings.","In the older version, the couplers have removable seal rings.","In the older version, the couplers have removable seal rings.","In the older version, the couplers have removable seal rings.","In the older version, the couplers have removable seal rings.","In the older version, the couplers have removable seal rings.","In the older version, the couplers have removable seal rings.","In the older version, the couplers have removable seal rings.","In the older version, the couplers have removable seal rings.",Problems with,Problems with
denuder breakage and leakage due to improper threading of the couplers with the denuders led to the,denuder breakage and leakage due to improper threading of the couplers with the denuders led to the,denuder breakage and leakage due to improper threading of the couplers with the denuders led to the,denuder breakage and leakage due to improper threading of the couplers with the denuders led to the,denuder breakage and leakage due to improper threading of the couplers with the denuders led to the,denuder breakage and leakage due to improper threading of the couplers with the denuders led to the,denuder breakage and leakage due to improper threading of the couplers with the denuders led to the,denuder breakage and leakage due to improper threading of the couplers with the denuders led to the,denuder breakage and leakage due to improper threading of the couplers with the denuders led to the,denuder breakage and leakage due to improper threading of the couplers with the denuders led to the,denuder breakage and leakage due to improper threading of the couplers with the denuders led to the,denuder breakage and leakage due to improper threading of the couplers with the denuders led to the,denuder breakage and leakage due to improper threading of the couplers with the denuders led to the
development of a second type of coupler.,development of a second type of coupler.,development of a second type of coupler.,development of a second type of coupler.,The new couplers are equipped with permanent seal rings that,The new couplers are equipped with permanent seal rings that,The new couplers are equipped with permanent seal rings that,The new couplers are equipped with permanent seal rings that,The new couplers are equipped with permanent seal rings that,The new couplers are equipped with permanent seal rings that,The new couplers are equipped with permanent seal rings that,The new couplers are equipped with permanent seal rings that,The new couplers are equipped with permanent seal rings that
provide more even threading and a better seal when coupled.,provide more even threading and a better seal when coupled.,provide more even threading and a better seal when coupled.,provide more even threading and a better seal when coupled.,provide more even threading and a better seal when coupled.,provide more even threading and a better seal when coupled.,provide more even threading and a better seal when coupled.,Some couplers have built-in flow-straighteners.,Some couplers have built-in flow-straighteners.,Some couplers have built-in flow-straighteners.,Some couplers have built-in flow-straighteners.,Some couplers have built-in flow-straighteners.,Some couplers have built-in flow-straighteners.
The couplers are used to couple the annular denuders and for coupling the last denuder with the filter pack.,The couplers are used to couple the annular denuders and for coupling the last denuder with the filter pack.,The couplers are used to couple the annular denuders and for coupling the last denuder with the filter pack.,The couplers are used to couple the annular denuders and for coupling the last denuder with the filter pack.,The couplers are used to couple the annular denuders and for coupling the last denuder with the filter pack.,The couplers are used to couple the annular denuders and for coupling the last denuder with the filter pack.,The couplers are used to couple the annular denuders and for coupling the last denuder with the filter pack.,The couplers are used to couple the annular denuders and for coupling the last denuder with the filter pack.,The couplers are used to couple the annular denuders and for coupling the last denuder with the filter pack.,The couplers are used to couple the annular denuders and for coupling the last denuder with the filter pack.,The couplers are used to couple the annular denuders and for coupling the last denuder with the filter pack.,The couplers are used to couple the annular denuders and for coupling the last denuder with the filter pack.,The couplers are used to couple the annular denuders and for coupling the last denuder with the filter pack.
7.1.7 Filter Pack Assembly (see Figure 8). The filters are supported by stainless steel porous screens and,7.1.7 Filter Pack Assembly (see Figure 8). The filters are supported by stainless steel porous screens and,7.1.7 Filter Pack Assembly (see Figure 8). The filters are supported by stainless steel porous screens and,7.1.7 Filter Pack Assembly (see Figure 8). The filters are supported by stainless steel porous screens and,7.1.7 Filter Pack Assembly (see Figure 8). The filters are supported by stainless steel porous screens and,7.1.7 Filter Pack Assembly (see Figure 8). The filters are supported by stainless steel porous screens and,7.1.7 Filter Pack Assembly (see Figure 8). The filters are supported by stainless steel porous screens and,7.1.7 Filter Pack Assembly (see Figure 8). The filters are supported by stainless steel porous screens and,7.1.7 Filter Pack Assembly (see Figure 8). The filters are supported by stainless steel porous screens and,7.1.7 Filter Pack Assembly (see Figure 8). The filters are supported by stainless steel porous screens and,7.1.7 Filter Pack Assembly (see Figure 8). The filters are supported by stainless steel porous screens and,7.1.7 Filter Pack Assembly (see Figure 8). The filters are supported by stainless steel porous screens and,7.1.7 Filter Pack Assembly (see Figure 8). The filters are supported by stainless steel porous screens and
housed in a polyethylene filter ring housing. The Teflon® filter ring housing directly follows the Teflon® filter,housed in a polyethylene filter ring housing. The Teflon® filter ring housing directly follows the Teflon® filter,housed in a polyethylene filter ring housing. The Teflon® filter ring housing directly follows the Teflon® filter,housed in a polyethylene filter ring housing. The Teflon® filter ring housing directly follows the Teflon® filter,housed in a polyethylene filter ring housing. The Teflon® filter ring housing directly follows the Teflon® filter,housed in a polyethylene filter ring housing. The Teflon® filter ring housing directly follows the Teflon® filter,housed in a polyethylene filter ring housing. The Teflon® filter ring housing directly follows the Teflon® filter,housed in a polyethylene filter ring housing. The Teflon® filter ring housing directly follows the Teflon® filter,housed in a polyethylene filter ring housing. The Teflon® filter ring housing directly follows the Teflon® filter,housed in a polyethylene filter ring housing. The Teflon® filter ring housing directly follows the Teflon® filter,housed in a polyethylene filter ring housing. The Teflon® filter ring housing directly follows the Teflon® filter,housed in a polyethylene filter ring housing. The Teflon® filter ring housing directly follows the Teflon® filter,housed in a polyethylene filter ring housing. The Teflon® filter ring housing directly follows the Teflon® filter
housing inlet component.,housing inlet component.,"The ""nylon"" filter ring housing follows the Teflon® filter ring housing and sits on a","The ""nylon"" filter ring housing follows the Teflon® filter ring housing and sits on a","The ""nylon"" filter ring housing follows the Teflon® filter ring housing and sits on a","The ""nylon"" filter ring housing follows the Teflon® filter ring housing and sits on a","The ""nylon"" filter ring housing follows the Teflon® filter ring housing and sits on a","The ""nylon"" filter ring housing follows the Teflon® filter ring housing and sits on a","The ""nylon"" filter ring housing follows the Teflon® filter ring housing and sits on a","The ""nylon"" filter ring housing follows the Teflon® filter ring housing and sits on a","The ""nylon"" filter ring housing follows the Teflon® filter ring housing and sits on a","The ""nylon"" filter ring housing follows the Teflon® filter ring housing and sits on a","The ""nylon"" filter ring housing follows the Teflon® filter ring housing and sits on a"
"Teflon® ""O""-ring, which seals the filter ring housing components to the filter housing outlet component.","Teflon® ""O""-ring, which seals the filter ring housing components to the filter housing outlet component.","Teflon® ""O""-ring, which seals the filter ring housing components to the filter housing outlet component.","Teflon® ""O""-ring, which seals the filter ring housing components to the filter housing outlet component.","Teflon® ""O""-ring, which seals the filter ring housing components to the filter housing outlet component.","Teflon® ""O""-ring, which seals the filter ring housing components to the filter housing outlet component.","Teflon® ""O""-ring, which seals the filter ring housing components to the filter housing outlet component.","Teflon® ""O""-ring, which seals the filter ring housing components to the filter housing outlet component.","Teflon® ""O""-ring, which seals the filter ring housing components to the filter housing outlet component.","Teflon® ""O""-ring, which seals the filter ring housing components to the filter housing outlet component.","Teflon® ""O""-ring, which seals the filter ring housing components to the filter housing outlet component.",The,The
filter housing outlet component is aluminum and accommodates a polyethylene screw sleeve that seals the filter,filter housing outlet component is aluminum and accommodates a polyethylene screw sleeve that seals the filter,filter housing outlet component is aluminum and accommodates a polyethylene screw sleeve that seals the filter,filter housing outlet component is aluminum and accommodates a polyethylene screw sleeve that seals the filter,filter housing outlet component is aluminum and accommodates a polyethylene screw sleeve that seals the filter,filter housing outlet component is aluminum and accommodates a polyethylene screw sleeve that seals the filter,filter housing outlet component is aluminum and accommodates a polyethylene screw sleeve that seals the filter,filter housing outlet component is aluminum and accommodates a polyethylene screw sleeve that seals the filter,filter housing outlet component is aluminum and accommodates a polyethylene screw sleeve that seals the filter,filter housing outlet component is aluminum and accommodates a polyethylene screw sleeve that seals the filter,filter housing outlet component is aluminum and accommodates a polyethylene screw sleeve that seals the filter,filter housing outlet component is aluminum and accommodates a polyethylene screw sleeve that seals the filter,filter housing outlet component is aluminum and accommodates a polyethylene screw sleeve that seals the filter
pack assembly.,The sleeve is available in different lengths to accommodate up to four filter ring housing units.,The sleeve is available in different lengths to accommodate up to four filter ring housing units.,The sleeve is available in different lengths to accommodate up to four filter ring housing units.,The sleeve is available in different lengths to accommodate up to four filter ring housing units.,The sleeve is available in different lengths to accommodate up to four filter ring housing units.,The sleeve is available in different lengths to accommodate up to four filter ring housing units.,The sleeve is available in different lengths to accommodate up to four filter ring housing units.,The sleeve is available in different lengths to accommodate up to four filter ring housing units.,The sleeve is available in different lengths to accommodate up to four filter ring housing units.,The sleeve is available in different lengths to accommodate up to four filter ring housing units.,The sleeve is available in different lengths to accommodate up to four filter ring housing units.,The sleeve is available in different lengths to accommodate up to four filter ring housing units.
A stainless,steel,"""Quick-Release""",plug,screws,into,the,aluminum,outlet,component,for,connecting,the
"pump-timer to the filter pack assembly. It is equipped with an orange ""dust cover"" (male plug) upon purchase.","pump-timer to the filter pack assembly. It is equipped with an orange ""dust cover"" (male plug) upon purchase.","pump-timer to the filter pack assembly. It is equipped with an orange ""dust cover"" (male plug) upon purchase.","pump-timer to the filter pack assembly. It is equipped with an orange ""dust cover"" (male plug) upon purchase.","pump-timer to the filter pack assembly. It is equipped with an orange ""dust cover"" (male plug) upon purchase.","pump-timer to the filter pack assembly. It is equipped with an orange ""dust cover"" (male plug) upon purchase.","pump-timer to the filter pack assembly. It is equipped with an orange ""dust cover"" (male plug) upon purchase.","pump-timer to the filter pack assembly. It is equipped with an orange ""dust cover"" (male plug) upon purchase.","pump-timer to the filter pack assembly. It is equipped with an orange ""dust cover"" (male plug) upon purchase.","pump-timer to the filter pack assembly. It is equipped with an orange ""dust cover"" (male plug) upon purchase.","pump-timer to the filter pack assembly. It is equipped with an orange ""dust cover"" (male plug) upon purchase.","pump-timer to the filter pack assembly. It is equipped with an orange ""dust cover"" (male plug) upon purchase.","pump-timer to the filter pack assembly. It is equipped with an orange ""dust cover"" (male plug) upon purchase."
7.1.8,Drying Manifold Assembly (see Figure 9).,Drying Manifold Assembly (see Figure 9).,Drying Manifold Assembly (see Figure 9).,Drying Manifold Assembly (see Figure 9).,Drying Manifold Assembly (see Figure 9).,Made of pyrex and is available to accommodate as,Made of pyrex and is available to accommodate as,Made of pyrex and is available to accommodate as,Made of pyrex and is available to accommodate as,Made of pyrex and is available to accommodate as,Made of pyrex and is available to accommodate as,Made of pyrex and is available to accommodate as
many as four drying denuders.,many as four drying denuders.,The denuders are attached to the manifold with back-to-back Bakalite bored,The denuders are attached to the manifold with back-to-back Bakalite bored,The denuders are attached to the manifold with back-to-back Bakalite bored,The denuders are attached to the manifold with back-to-back Bakalite bored,The denuders are attached to the manifold with back-to-back Bakalite bored,The denuders are attached to the manifold with back-to-back Bakalite bored,The denuders are attached to the manifold with back-to-back Bakalite bored,The denuders are attached to the manifold with back-to-back Bakalite bored,The denuders are attached to the manifold with back-to-back Bakalite bored,The denuders are attached to the manifold with back-to-back Bakalite bored,The denuders are attached to the manifold with back-to-back Bakalite bored
caps.,The bored caps are connected with a Teflon® connector ring. Air is pushed through an air dryer/ cleaner,The bored caps are connected with a Teflon® connector ring. Air is pushed through an air dryer/ cleaner,The bored caps are connected with a Teflon® connector ring. Air is pushed through an air dryer/ cleaner,The bored caps are connected with a Teflon® connector ring. Air is pushed through an air dryer/ cleaner,The bored caps are connected with a Teflon® connector ring. Air is pushed through an air dryer/ cleaner,The bored caps are connected with a Teflon® connector ring. Air is pushed through an air dryer/ cleaner,The bored caps are connected with a Teflon® connector ring. Air is pushed through an air dryer/ cleaner,The bored caps are connected with a Teflon® connector ring. Air is pushed through an air dryer/ cleaner,The bored caps are connected with a Teflon® connector ring. Air is pushed through an air dryer/ cleaner,The bored caps are connected with a Teflon® connector ring. Air is pushed through an air dryer/ cleaner,The bored caps are connected with a Teflon® connector ring. Air is pushed through an air dryer/ cleaner,The bored caps are connected with a Teflon® connector ring. Air is pushed through an air dryer/ cleaner
